{
  "$schema": "https://json-schema.org/draft/2020-12/schema",
  "$id": "https://copse.dev/schemas/copse-pack.schema.json",
  "title": "Legacy Copse feature-pack manifest",
  "description": "Legacy Copse manifest schema retained for compatibility. New packages use the Agent Plugins v1.0.0 root plugin.json envelope with Copse-only declarations under extensions[\"dev.copse\"]. This schema is not the portable plugin.json schema. See docs/plugins.md and docs/plans/agent-plugins-migration.md.",
  "type": "object",
  "additionalProperties": false,
  "required": ["name"],
  "allOf": [
    {
      "if": { "required": ["models"] },
      "then": { "required": ["runtime"] }
    },
    {
      "if": { "required": ["browser"] },
      "then": { "required": ["models", "runtime"] }
    },
    {
      "if": {
        "required": ["tools"],
        "properties": { "tools": { "required": ["provides"] } }
      },
      "then": { "required": ["runtime"] }
    }
  ],
  "properties": {
    "name": {
      "description": "Pack id / name (plugin.json `name`). Also the grouping key across all slots.",
      "type": "string",
      "minLength": 1
    },
    "version": {
      "description": "Pack version (plugin.json `version`).",
      "type": "string"
    },
    "description": {
      "description": "Human description shown in the Settings pack list (P3).",
      "type": "string"
    },
    "trust": {
      "description": "Descriptive trust claim only. A discovered manifest is always `user`; first-party trust is assigned by code and cannot be self-granted by this field.",
      "enum": ["first-party", "user"]
    },
    "stability": {
      "description": "Product-support status shown before enablement. Missing user-pack values are treated as experimental; every first-party pack declares this explicitly (decision 19).",
      "enum": ["stable", "experimental"]
    },
    "skills": {
      "description": "Existing plugin.json slot: relative path to a skills directory.",
      "type": "string"
    },
    "tools": {
      "description": "Tool behavior: in-process names from first-party code, executable tools from an explicitly selected user pack, or an MCP config path.",
      "type": "object",
      "additionalProperties": false,
      "properties": {
        "native": {
          "description": "Native tool names added to the model tool list while enabled (first-party).",
          "type": "array",
          "items": { "type": "string" }
        },
        "acpTools": {
          "description": "Subset of native tools safe to offer to external ACP agents through Copse's authenticated localhost bridge (first-party only).",
          "type": "array",
          "items": { "type": "string" }
        },
        "provides": {
          "description": "Tool names an explicitly selected pack provides through its isolated runtime.",
          "type": "array",
          "items": { "type": "string", "minLength": 1 },
          "minItems": 1,
          "uniqueItems": true
        },
        "mcpServers": {
          "description": "Path to an MCP config file (user packs), like the plugin.json `mcpServers` field.",
          "type": "string"
        }
      }
    },
    "models": {
      "description": "Thread-model behavior supplied by an explicitly selected pack.",
      "type": "object",
      "additionalProperties": false,
      "required": ["provides"],
      "properties": {
        "provides": {
          "type": "array",
          "minItems": 1,
          "items": {
            "type": "object",
            "additionalProperties": false,
            "required": ["id", "label"],
            "properties": {
              "id": { "type": "string", "minLength": 1 },
              "label": { "type": "string", "minLength": 1 },
              "group": { "type": "string", "minLength": 1 },
              "description": { "type": "string" },
              "supportsImages": { "type": "boolean" }
            }
          }
        }
      }
    },
    "browser": {
      "description": "Exact origins an explicitly selected model pack may operate in the visible interactive browser pane. This grants only the bounded browser operations in runtime API v1, not direct network or Electron access.",
      "type": "object",
      "additionalProperties": false,
      "required": ["origins"],
      "properties": {
        "origins": {
          "type": "array",
          "minItems": 1,
          "maxItems": 64,
          "uniqueItems": true,
          "items": {
            "type": "string",
            "minLength": 1,
            "maxLength": 2048,
            "pattern": "^https?://"
          }
        }
      }
    },
    "runtime": {
      "description": "Versioned isolated runtime shared by this selected pack's executable behaviors.",
      "type": "object",
      "additionalProperties": false,
      "required": ["entrypoint", "apiVersion"],
      "properties": {
        "entrypoint": {
          "description": "Relative runtime entrypoint; absolute paths and pack-root escapes are rejected.",
          "type": "string",
          "minLength": 1
        },
        "apiVersion": { "const": 1 },
        "hooks": {
          "description": "Declared isolated function-hook registrations. IDs must be unique. Registration and explicit host invocation are supported; automatic event dispatch is not yet wired.",
          "type": "array",
          "minItems": 1,
          "maxItems": 1000,
          "items": {
            "type": "object",
            "additionalProperties": false,
            "required": ["id", "event"],
            "properties": {
              "id": { "type": "string", "minLength": 1, "maxLength": 128 },
              "event": {
                "enum": [
                  "turnStart",
                  "beforeFinalize",
                  "stepBoundary",
                  "beforeSubmitPrompt",
                  "toolGate",
                  "afterFileEdit",
                  "stop",
                  "afterToolUse",
                  "subagentStart",
                  "subagentStop",
                  "sessionStart",
                  "compaction",
                  "permissionDecision",
                  "beforeDiffApply",
                  "afterDiffApply",
                  "postTurnReview",
                  "modelSelected"
                ]
              }
            }
          }
        }
      }
    },
    "hooks": {
      "description": "Command-hook declarations (user packs). First-party function hooks are typed runtime contributions defined in code, not declared here (decision 15).",
      "type": "array",
      "items": {
        "type": "object",
        "additionalProperties": false,
        "required": ["event", "command"],
        "properties": {
          "event": {
            "description": "Canonical event name the hook subscribes to.",
            "type": "string"
          },
          "command": {
            "description": "Shell command spawned when the event fires.",
            "type": "string"
          }
        }
      }
    },
    "prompt": {
      "description": "Prompt / steering blocks folded into assembly while enabled, each with trust framing.",
      "type": "array",
      "items": {
        "type": "object",
        "additionalProperties": false,
        "required": ["id", "text", "trust"],
        "properties": {
          "id": { "type": "string" },
          "text": { "type": "string" },
          "trust": {
            "description": "A `trusted` (first-party) block is injected verbatim; an `untrusted` (user) block is delimited as data.",
            "enum": ["trusted", "untrusted"]
          }
        }
      }
    },
    "ui": {
      "description": "UI contributions. Level 1 = declarative cards, level 2 = a named panel slot fed structured data, level 3 = a real renderer view (first-party).",
      "type": "array",
      "items": {
        "type": "object",
        "additionalProperties": false,
        "required": ["id", "level"],
        "properties": {
          "id": { "type": "string" },
          "level": {
            "description": "UI contribution level (1–3).",
            "enum": [1, 2, 3]
          },
          "slot": {
            "description": "Named host slot this mounts into (level 2/3); omitted for level-1 cards.",
            "type": "string"
          },
          "title": {
            "description": "Human title for the Settings pack-list enumeration (P3).",
            "type": "string"
          },
          "panel": {
            "description": "Level-2 refinement (P2). Declares the panel shape the pack emits so the host can validate incoming panel_update payloads. Required when level = 2; the host rejects a level-2 contribution without a panel decl.",
            "type": "object",
            "additionalProperties": false,
            "required": ["kind"],
            "properties": {
              "kind": {
                "description": "Data shape: a flat ordered list (ACP plan–shaped) or a nested tree.",
                "enum": ["list", "tree"]
              },
              "header": {
                "description": "Human header rendered above the panel; falls back to the contribution `title`.",
                "type": "string"
              },
              "ariaLabel": {
                "description": "Optional a11y label; defaults to `header` / contribution `title`.",
                "type": "string"
              }
            }
          }
        }
      }
    },
    "followUps": {
      "description": "Follow-up bubbles the pack suggests above the composer while enabled — the offer-shaped alternative to interrupting with a modal. The host decides whether to show each one (`when`) and what its click does (`action`).",
      "type": "array",
      "items": {
        "type": "object",
        "additionalProperties": false,
        "required": ["id", "label"],
        "properties": {
          "id": {
            "description": "Stable suggestion id — the bubble's data-id and its dedupe key. A collision with a host preset id (changes, debug-ci, …) loses.",
            "type": "string",
            "minLength": 1
          },
          "label": {
            "description": "Bubble text. Bubbles sit in one row above the composer, so keep it short.",
            "type": "string",
            "minLength": 1
          },
          "prompt": {
            "description": "The message the bubble sends when `action` is `prompt`. Required for a prompt bubble — one with nothing to send is a dead click.",
            "type": "string"
          },
          "action": {
            "description": "What the click does. `prompt` (the default) sends `prompt` to the agent. Host actions such as `review` are first-party only: a discovered manifest is forced back to `prompt`, whatever it declares here.",
            "enum": ["prompt", "review"]
          },
          "when": {
            "description": "When the host offers the bubble: `always` (the default), or `workspace-changes` for only while the working tree has uncommitted changes.",
            "enum": ["always", "workspace-changes"]
          }
        }
      }
    },
    "capabilities": {
      "description": "Named runtime capability flags the pack owns — pure cross-cutting behaviour (no tool/hook/prompt/panel), read by any subsystem through the registry's isCapabilityActive seam and enumerated in Settings (P3).",
      "type": "array",
      "items": {
        "type": "object",
        "additionalProperties": false,
        "required": ["name", "title"],
        "properties": {
          "name": {
            "description": "Stable capability id subsystems read via isCapabilityActive.",
            "type": "string",
            "minLength": 1
          },
          "title": {
            "description": "Human title for the Settings pack-list enumeration.",
            "type": "string"
          },
          "description": {
            "description": "Optional human description shown alongside the title.",
            "type": "string"
          }
        }
      }
    },
    "permissions": {
      "description": "Permission / sandbox relaxations the pack DECLARES it may request (issue #1190) — the authority it opens. The permission-gate only grants a declared relaxation while the owning pack is enabled; disabling the pack revokes it atomically. Enumerated in Settings and exposed for the install-time capability/permission review (#1082).",
      "type": "array",
      "items": {
        "type": "object",
        "additionalProperties": false,
        "required": ["name", "title"],
        "properties": {
          "name": {
            "description": "Stable relaxation id the permission-gate resolves via isPermissionDeclared.",
            "type": "string",
            "minLength": 1
          },
          "title": {
            "description": "Human title for the Settings pack-list enumeration.",
            "type": "string"
          },
          "description": {
            "description": "Optional human description of the authority the relaxation opens.",
            "type": "string"
          },
          "scope": {
            "description": "Granularity of the permission grant that gates the relaxation (defaults to project).",
            "enum": ["project", "workspace"]
          }
        }
      }
    },
    "settings": {
      "description": "Pack-scoped settings schema, keyed by setting id, rendered generically in Settings (P3).",
      "type": "object",
      "additionalProperties": {
        "type": "object",
        "additionalProperties": false,
        "required": ["kind", "title"],
        "properties": {
          "kind": { "enum": ["boolean", "string", "number", "enum", "model"] },
          "title": { "type": "string" },
          "description": { "type": "string" },
          "default": {
            "description": "Default value. For a `model` field this is an optional default model id (string).",
            "type": ["boolean", "string", "number"]
          },
          "options": {
            "description": "Allowed values for an `enum` field. A `model` field takes no static options — its list is the live model catalogue resolved host-side at read time.",
            "type": "array",
            "items": { "type": "string" }
          }
        }
      }
    },
    "storage": {
      "description": "Namespaced storage declaration. Pack state persists across disable, like a disabled browser extension's data (decision 17).",
      "type": "object",
      "additionalProperties": false,
      "required": ["namespace"],
      "properties": {
        "namespace": { "type": "string", "minLength": 1 }
      }
    }
  }
}
